id,value,category,label,info
4087,3,person,瑞珠,"秦可卿的丫环。秦可卿生前与公公贾珍关系暧昧，服侍秦可卿的瑞珠应该有所觉察，因此受到贾珍的威胁。秦可卿死后，瑞珠触柱而亡。"
4088,3,person,藕官,"藕官是贾家买来的十二个唱戏的优伶之一，小戏子。为人义气，当她的朋友芳官被赵姨娘侮辱时，藕官冒着随时被驱逐的危险和伙伴们一起将平时不可一世的姨娘打了个痛快。戏班解散后，她成了林黛玉的丫环。后来因不肯聘嫁他人而出家为尼，长伴青灯古佛。"
4089,1,person,蕊官,"蕊官是梨香院女伶，后遁入空门。"
4090,2,person,入画,"贾惜春的丫环。因她父母在南方，她和哥哥只好跟随叔叔过日子，可叔叔婶婶只知道喝酒赌钱，她哥哥只好把做小厮所得的赏赐托人交给她保管，抄检大观园时被发现。贾惜春非要把她撵走，入画跪地哀求，百般苦告，尤氏只得叫人将入画带到宁府。"
4091,1,person,彩屏,"贾惜春的一名丫鬟。"
4092,1,person,彩儿,"服侍贾惜春的小小丫环。"
4093,1,person,丰儿,"王熙凤的小丫环。在王熙凤房中位置仅次于平儿。"
4094,1,person,绣橘,"贾迎春的丫头，她伶牙俐齿、好胜争强。是一个一心护主的二等小丫鬟，为了迎春，她跟王住儿媳妇为攒珠累丝金凤快言快语地吵架，吵不出结果时又气又急，竟至于哭了。对懦小姐迎春的“只是脸软怕人恼”，众人是无奈兼觉得好笑，绣橘却是满心的着急忧虑和奋力维护。绣橘第二次出场，是司棋被撵走时，她在大观园中哭着赶来给司棋送绢包，说是姑娘给的，做个念想吧。最后，迎春被贾赦许嫁孙绍祖之时，绣橘是四个陪嫁丫鬟之一。绣橘性格泼辣，有义护义。"
4095,2,person,侍书,"侍书是中国古典名著《红楼梦》中的虚拟人物，她是贾探春的丫鬟，心眼灵活，口齿伶俐。最后结局是跟随探春远嫁。她的名字有很大争议，一作“侍书”。"
4096,2,person,小鹊,"小鹊这个名字具有讽刺意味，喜鹊是报喜的，而她却是报忧的。小鹊是个机灵、有心机的丫头。"
4097,1,person,翠缕,"史湘云的丫环。她是一位天真的丫鬟，性格如湘云一般，豪爽直言。"
4098,1,person,榛儿,"香菱的丫鬟。"
4099,1,person,小螺,"薛宝琴的小丫环（首见第五十回），即宝琴立雪时，在宝琴身后抱一瓶红梅者。"
4100,1,person,篆儿,"邢岫烟丫环，岫烟曾命她悄悄地将当票递与莺儿，交给薛宝钗。"
4101,1,person,茄官,"贾府梨香院优伶，饰老旦。"
4102,2,person,善姐,"本为王熙凤身边的丫头，后被凤姐特意送给尤二姐使唤。“善姐”二字实为反讽：名为“善”，但其人不善。 善姐伶牙俐齿，时时对尤二姐冷嘲热讽，又“不服使唤”，故意在饮食起居上作践二姐。善姐之“不善”，实为凤姐逼死尤二姐的阴险步骤之一，故《脂》批说：“写使女欺压二姐，正写凤姐欺压二姐。”"
4103,2,person,素云,"素云是李纨的丫环。"
4104,1,person,小吉祥儿,"赵姨娘跟前的一个小丫头。"
4105,1,person,葵官,"贾府买来的十二个唱戏的女孩子之一。后来成为湘云的丫鬟。"
4106,2,person,宝珠,"秦可卿的丫环。秦可卿死后，宝珠见秦氏没有孩子，愿为义女，请任摔丧驾灵之任，后在铁槛寺陪伴秦可卿之灵，执意不肯回宁国府。"
4107,1,person,同贵,"同贵是曹雪芹小说《红楼梦》中的人物，出场身份是薛姨妈的丫头"
4108,1,person,炒豆儿,"尤氏身边的小丫头。在李纨房中，炒豆儿为尤氏端水只弯腰捧着，被李纨斥责后才跪下。事情发生在大观园抄检之后，显示出最讲等级规矩的贾府实际上已经纪律松散，衰败的现象逐步加剧，仆妇佣人也不那么服帖了。"
4109,1,person,银蝶,"尤氏的丫头。"
4110,2,person,小舍儿,"小舍儿是金桂从小儿在家使唤的。"
4111,1,person,艾官,"贾府梨香院女伶，饰老外。戏班解散后，她做了探春的丫头。夏婆子调唆赵姨娘辱打芳官，恰被她听见，便悄悄地回了探春，探春却料定她与芳官等“皆饰一党，本皆淘气异常，便只答应，也不肯据此为实”。众女伶被逐出大观园后，她被干娘领出自行聘嫁。"
4112,1,person,文官,"贾府中十二个唱戏的女子之一，饰小生。在“十二官”中是个领头的，她由于口齿伶俐，甚得贾母欢心，薛姨妈等人也赞为“好个灵透孩子”，戏班解散后，贾母便留下她自使。此后没再出场。众女伶被王夫人逐出大观园时她因在贾母身边而没被牵连进去。"
4113,5,person,彩霞,"彩霞是王夫人的大丫头，有时却又是赵姨娘身边的二等丫头。她非常能干，不仅要提醒王夫人大小家事，就连贾政在家出外去的一应大小家事，也得由她记着。她和贾环还合得来，不时规劝他安分些，何苦讨人嫌，但贾环并不领情。赵姨娘素日和彩霞好，巴不得彩霞能嫁给贾环，自己有个臂膀。赵姨娘求贾政说情，又要贾环去讨，贾环却认为不过是个丫头，丢开手便走了。后由王熙凤和贾琏作主，配给容貌丑陋、酗酒赌博的旺儿之子。"
4114,1,person,娇红,"邢夫人的丫头。"
4115,3,person,秋桐,"原为贾赦的丫环。贾琏偷娶尤二姐后，出门为父亲贾赦办事，事情办的很出色，贾赦十分欢喜，夸他能干，把秋桐赏他为妾。秋桐自以为揣摩到了凤姐的心思，加上自己是贾赦所赐，无人敢冒犯她。王熙凤曾借她用“借剑杀人”之计，把尤二姐迫害而死。"
4116,1,person,小吉祥,"赵姨娘的丫头。"
4117,3,person,娇杏,"娇杏是《红楼梦》中甄家的丫环，金陵十二钗副册。 “ 生得仪容不俗，眉目清秀，虽无十分姿色，却亦有动人之处。”"
4118,1,person,菂官,"作药官，《红楼梦》人物，系贾府买来的十二个唱戏的女孩之一，饰小旦。她在戏中与小生藕官常扮夫妻，二人相好异常，同性相恋。但不久她夭亡了，致使藕官伤心欲绝，哭得死去活来。"
4119,5,person,旺儿媳妇,"荣府女仆，王熙凤的陪房。她仗着与丈夫一起专替凤姐出力办事，放账收债。故无所忌惮，她倚势为“酗酒赌博”，“容貌丑陋”的儿子强娶彩霞，逼得彩霞之母纵不愿意也只好忍气吞声同意了。她是奴仆中的一“霸”。"
4120,2,person,王嬷嬷,"王嬷嬷是《红楼梦》中林黛玉的奶娘，贾老太君说王嬷嬷已经很老，料黛玉使唤不如意，于是又给黛玉安排了紫鹃这个丫鬟。"
4121,3,person,李嬷嬷,"贾宝玉的乳母。她是一个年老爱唠叨的人。儿子李贵是跟宝玉上学的仆人。"
4122,4,person,多姑娘,"多姑娘出场就是跟贾琏的一次偷情。多姑娘也是晴雯的表嫂，在晴雯临死病重、宝玉前去探望之时，她“便坐在炕沿上，却紧紧的将宝玉搂入怀中。”但后来，得知宝玉是来为情探望晴雯，便说“如今我反后悔错怪了你们。既然如此，你但放心。以后你只管来，我也不罗唣你”。也看出来了她的善以及对真爱的一丝羡慕，因为在作者的笔下，“多姑娘儿”代表了女性对男权社会的一种反抗，寄托了作者对女性解放的希望。对多姑娘的描写与对贾宝玉的描写遥相呼应，突出了作者的写作技巧。"
4123,3,person,赖大家的,"赖大家的是贾府管家赖大的妻子，人们称她为赖大家的。"
4124,4,person,吴兴登家的,"王夫人房里的仆人。"
4125,6,person,王善保家的,"王善保家的，是中国著名古典小说《红楼梦》中的人物，她是荣国府大房太太邢夫人的陪房婆子，也是邢夫人的心腹。"
4126,3,person,柳嫂子,"大观园内厨房主管，柳五儿之母。她曾经在十二个小戏子暗指的梨香院里当厨子，因此与小戏子芳官儿交好。她想通过芳官把女儿送进贾宝玉所住的怡红院，故对怡红院中人格外照顾。她巴结晴雯芳官儿，因此怠慢得罪了贾迎春的丫头司棋，被司棋领着缀锦楼的丫头们将大厨房一通乱砸，柳家的怕了，等司棋回去。她忙蒸了司棋要的蛋羹，却被司棋泼于地下。后因小丫头莲花儿等，她被牵连到“玫瑰露”事件。秦显家的乘机买通林之孝家的，企图撵柳家母女出去，并接管厨房。次日，“玫瑰露”事件被平儿按下，柳嫂母女冤情大白，才又回到内厨房管事。"
4127,3,person,李纹,"李婶娘之女，李纨堂妹。雪芹先生写其有超脱、淡然之美。其性格如梅——美丽高冷却又不失坚韧，与其柔弱寡断的堂姐胞妹——李纨和李绮有着鲜明的对比。后四十回结局猜想：也许并非世人所续“随便嫁了个人”，而可能是与薛宝琴、邢岫烟扮演不同的“悲剧红颜”。一些专家猜测，李纹很有可能是与妙玉一同被拐走。"
4128,3,person,李绮,"李纹的妹妹，李纨的堂妹，李纨寡婶之女。金陵十二钗副册之一，书中李绮被称赞是个水葱儿般水灵的姑娘。"
4129,4,person,李婶娘,"李纹、李绮之母。"
4130,3,person,青儿,"青儿--王狗儿之女（首见《红楼梦》第六回）。贾府被抄后，刘姥姥带她进府探望，恰逢王仁等要将巧姐送给外藩王爷，巧姐就扮作青儿模样避走乡下。"
4131,6,person,周瑞家的,"周瑞家的，是王夫人的陪房，冷子兴的岳母。常在大观园及王夫人、琏二奶奶处做事露面。处事较为圆滑、见风使舵，是贾宝玉口中典型的“鱼眼睛”形象。 在荣国府里，周瑞家的管太太奶奶们出行的事。她的丈夫周瑞管宁国府地租庄子银钱的出入。"
4132,4,person,林之孝家的,"林之孝家的是林红玉（小红）之母，也是荣国府大管家之一，为人行事低调，与其夫被喻为“天聋地哑”，地处管家高位却如此行事低调，实属难得，但也是媚上欺下，时不时也会利用自己的权利谋些好处。"
4133,2,person,柳五儿,"柳嫂子之女，十六岁，她虽是厨役之女，书中形容她生得人物与平、袭、鸳、紫相类，说她相貌与平儿、鸳鸯、袭人、紫鹃等人一样的漂亮。因他排行第五，便叫他五儿。五儿和宝玉的丫鬟芳官是好朋友，芳官把宝玉喝剩的玫瑰露给了她，因母亲不慎得罪了司棋等人，被冠以偷窃的贼名。幸亏平儿相助，她们母女的冤情得以洗清，柳五儿在曹雪芹前八十回因此事已经病死，后续书却把她写活了，并安排成为贾宝玉的丫环。"
4134,1,person,秦显家的,"在《红楼梦》中是个极次要的人物，她在第六十一回《投鼠忌器宝玉瞒赃 判冤决狱平儿行权》末尾方被提及，到第六十二回《憨湘云醉眠芍药茵 呆香菱情解石榴裙》开篇一现，曹公写她只有寥寥三百来字，但却构成一个令人难忘的艺术形象。"
4135,2,person,莲花儿,"迎春房里的小丫头。司棋让她吩咐厨房炖鸡蛋，柳嫂不从，她就同柳嫂口角，后又赌气添了一大篇话，惹得司棋火起，带领丫头们大闹厨房。"
4136,2,person,金氏,"贾璜之妻。"
4138,2,person,五嫂子,"贾芸之母。"
4139,2,person,来升媳妇,"宁府都总管赖二之妻。在秦氏丧仪中听凤姐令，每日揽总查看，不敢疏忽。"
4140,2,person,龄官,"龄官是清代小说《红楼梦》中的女性人物，贾家买来的十二个唱戏的女孩之一。戏活极好，长相、气质很像林黛玉，也有着林黛玉的敏感与清高，相当于林黛玉的一个射影，素与贾蔷相好。与贾蔷的爱情也给了宝玉不一样的启发。"
4141,5,person,封氏,"封氏是曹雪芹小说《红楼梦》中的人物，甄士隐的夫人。"
4142,2,person,赖嬷嬷,"贾府管事之一，赖大的母亲，孙子赖尚荣在贾府的帮助做了知县，该人物在贾府里属于年高而有体面的嬷嬷。"
4143,1,person,周姨娘,"周姨娘为贾政妾，常与赵姨娘一起出现于奉侍贾母的场面上。"
4144,1,person,翠云,"贾赦之妾。"
4145,1,person,嫣红,"出自《红楼梦》第四十七回《呆霸王调情遭苦打 冷郎君惧祸走他乡》。邢夫人将方才的话只略说了几句，贾赦无法，又含愧，自此便告病，且不敢见贾母，只打发邢夫人及贾琏每日过去请安。只得又各处遣人购求寻觅，终究费了八百两银子买了一个十七岁的女孩子来，名唤嫣红，收在屋内。不在话下。"
4146,3,person,坠儿,"宝玉的小丫头，因偷了平儿的一个镯子，被晴雯得知后，气得晴雯蛾眉倒蹙，凤眼圆睁，把她撵了出去。值得注意的是，曹雪芹有意把小红和坠儿设计成一对密友，这在那个时代，那种社会环境里，特别是在赫赫森严的贵族府邸里，她们的作为，她们的话语，才是真正具有叛逆性的，是晴雯等望尘莫及的，放射出真正的人性光辉。"
4147,2,person,智能儿,"秦钟之相好。"
4148,1,person,净虚,"馒头庵的姑子净虚，小尼姑智能儿的师父。馒头庵就是水月庵，因他庙里做的馒头好，就起了这个浑号，离铁槛寺不远。"
4149,3,person,万儿,"贾珍、尤氏的丫头。"
4150,2,person,司棋母,"-迎春丫环司棋的母亲，阻挠女儿和自己的侄儿自己结合，以致潘又安、司棋双双徇情自尽。"
4151,2,person,白大娘,"金钏、玉钏之母"
4152,1,person,尤老娘,"尤二姐、尤三姐的亲娘，也是宁国府尤氏的继母，两个女儿也与尤氏没有血缘关系。她的两个女儿都生的青春貌美，她想用国色天香的尤二姐来嫁给贾琏，提高她在贾府的地位，可是后来尤二姐被凤姐害死了，尤三姐也因想柳湘莲订婚不成，自刎了。从母亲的角度来说，她是一个失败的母亲，失去了两个女儿。"
4153,1,person,周奶奶,"史湘云之奶妈。"
4154,1,person,豆官,"贾家买来唱戏的女优伶。饰小花脸。身量年纪皆极小，又极鬼灵，故曰豆官。戏班解散后，随侍薛宝琴。从此，园中人或唤她“阿豆”，或唤作“炒豆子”，而薛宝琴则将她打扮成琴童摸样，唤作“豆童”。"
4155,1,person,文花,"贾珍的小妾，很会唱曲。书中称她“喉清嗓嫩，真令人魂醉魄飞。”"
4156,3,person,赵嬷嬷,"贾琏的乳母。曾求贾琏夫妇给她的两个儿子找份差事干。"
4157,1,person,娄氏,"贾菌之母。"
4158,1,person,老叶妈,"怡红院老妈子，宝玉小厮茗烟之母，与莺儿妈相善，莺儿还认她作干娘。"
4160,1,person,周氏,"贾芹之母。"
4161,1,person,佩凤,"贾珍之妾，年青姣憨之女子。"
4162,2,person,代儒夫人,"贾瑞之祖母。"
4163,2,person,春燕,"何婆子之女，贾宝玉房内的二等丫鬟，贾府内世仆的女孩，聪明伶俐乐于助人。"
4164,1,person,何婆子,"秦钟的丫头春燕之母。"
4165,1,person,碧痕,"碧痕是贾宝玉房里的一个丫鬟。曾经在红楼梦中第20，24，26，31，77回出现过，碧痕的长相在书中从未出现过，有两次描写她的牙尖嘴利，心气很高。"
4166,1,person,笑儿,"史湘云的丫头。"
4167,2,person,警幻仙姑,"太虚幻境司主，相当于西方的维纳斯、丘比特。她首次提出“意淫”的概念。《红楼梦》第五回，她受宁荣二公所托，让宝玉阅览金陵十二钗命运簿册，聆听《红楼梦曲》十四支，又将妹妹可卿许配于宝玉，引导宝玉“留意于孔孟之间，委身于经济之道”。警幻之名，即设计情欲声色梦幻警醒宝玉入于仕途经济正路。无奈宝玉竟未悟，梦醒后依然不改意淫志行，直到后四十回第二梦才了悟。根据《红楼梦》中的脂批探佚，警幻仙子应该在最后一回中展示警幻情榜。"
4168,4,person,马道婆,"贾宝玉寄名的干娘，是个搞封建迷信，邪魔歪道的混帐东西，经常出入贾府各房各屋。"
4169,5,person,南安太妃,"南安太妃是中国古典小说《红楼梦》中的人物。南安太妃在小说中出场不多，但是决定了贾府三小姐探春的命运。贾母过生日的那一次，她前来赴宴应酬，见到了宝钗、黛玉、湘云和探春，对这几个女孩子她非常喜欢。"
4170,1,person,夏婆子,"夏婆子是红楼梦中的一个人物，她是藕官的干娘，小蝉的外婆，平日在大观园当差。"
4171,1,person,费婆子,"邢夫人的陪房。"
4172,4,person,周瑞之女,"周瑞之女。"
4173,2,person,绛珠仙子,"传说中的美女仙，还传说是贾宝玉和林黛玉的第二世情缘，是绛珠仙子在“五衷内对神瑛侍者郁结着缠绵不尽之意”，一心回报神瑛侍者的灌溉之恩。"
